{
  "schemaVersion": "dungeonq.scenario/v1",
  "scenarioId": "syn-honey-credential-001",
  "title": "Honey credential replay",
  "summary": "A controlled synthetic credential appears on a decoy-facing session.",
  "classification": "SYNTHETIC_ONLY",
  "seed": "DQ-HONEY-001",
  "subject": {
    "type": "SESSION",
    "id": "syn-session-honey-001"
  },
  "environment": {
    "tenantId": "syn-tenant-honey-001",
    "assets": [
      {
        "id": "syn-identity-honey-001",
        "kind": "IDENTITY",
        "criticality": "CRITICAL",
        "initialState": "AVAILABLE"
      }
    ]
  },
  "policy": {
    "policyId": "syn-policy-honey-001",
    "deceptionThreshold": 60,
    "quarantineThreshold": 80,
    "denyThreshold": 95,
    "maxAutomatedScope": 1,
    "budgetUnits": 100,
    "approvalRequiredEffects": [
      "ROTATE_CREDENTIAL"
    ]
  },
  "signals": [
    {
      "id": "syn-signal-honey-001",
      "sourceId": "syn-honey-sensor-001",
      "sourceClass": "CONTROLLED_HONEY",
      "independenceGroup": "syn-edge-a",
      "kind": "HONEY_CREDENTIAL_USED",
      "confidence": 98,
      "subjectId": "syn-session-honey-001",
      "evidence": "Synthetic honey credential replay observed"
    }
  ],
  "failures": [],
  "requestedEffect": {
    "type": "ROTATE_CREDENTIAL",
    "targetAssetId": "syn-identity-honey-001",
    "scope": 1,
    "costUnits": 10
  },
  "expected": {
    "route": "DENY",
    "approvalRequired": true,
    "effectExecutable": true,
    "requiredInvariantIds": [
      "DQ-INV-001",
      "DQ-INV-003",
      "DQ-INV-004"
    ]
  }
}
